{
  "dados": [
    {
      "nome": "CDB-DI\nCDB-DI",
      "tipo": "FundoInvestimento",
      "instituicao": "itau",
      "membro": "",
      "valor_atual": 116374.26,
      "data_referencia": "2026-03-02",
      "taxa": "",
      "vencimento": ""
    },
    {
      "nome": "Itau Prev Corp\nPlatinum Rv49\nMm Pgbl\nItau Prev Corp\nPlatinum Rv49\nMm Pgbl",
      "tipo": "FundoInvestimento",
      "instituicao": "itau",
      "membro": "",
      "valor_atual": 18715.24,
      "data_referencia": "2026-03-02",
      "taxa": "",
      "vencimento": ""
    },
    {
      "nome": "total investido",
      "tipo": "FundoInvestimento",
      "instituicao": "itau",
      "membro": "",
      "valor_atual": 341581.2,
      "data_referencia": "2026-03-02",
      "taxa": "",
      "vencimento": ""
    },
    {
      "nome": "total investido",
      "tipo": "FundoInvestimento",
      "instituicao": "itau",
      "membro": "",
      "valor_atual": 341581.2,
      "data_referencia": "2026-03-02",
      "taxa": "",
      "vencimento": ""
    },
    {
      "nome": "64",
      "tipo": "FundoInvestimento",
      "instituicao": "rico",
      "membro": "",
      "valor_atual": 17186.4,
      "data_referencia": "2026-03-29",
      "taxa": "",
      "vencimento": ""
    },
    {
      "nome": "24",
      "tipo": "FundoInvestimento",
      "instituicao": "rico",
      "membro": "",
      "valor_atual": 17186.4,
      "data_referencia": "2026-03-29",
      "taxa": "",
      "vencimento": ""
    },
    {
      "nome": "Fundos de Investimentos",
      "tipo": "FundoInvestimento",
      "instituicao": "rico",
      "membro": "",
      "valor_atual": 164689.98,
      "data_referencia": "2026-03-29",
      "taxa": "",
      "vencimento": ""
    },
    {
      "nome": "VEL I",
      "tipo": "FundoInvestimento",
      "instituicao": "rico",
      "membro": "",
      "valor_atual": 52443.66,
      "data_referencia": "2026-03-29",
      "taxa": "",
      "vencimento": ""
    },
    {
      "nome": "00 R\nAlaska Institucional Long Only FIF em\n28",
      "tipo": "FundoInvestimento",
      "instituicao": "rico",
      "membro": "",
      "valor_atual": 52294.2,
      "data_referencia": "2026-03-29",
      "taxa": "",
      "vencimento": ""
    },
    {
      "nome": "es RL\n48 Safari 30 FIF em Cotas de FIM II",
      "tipo": "FundoInvestimento",
      "instituicao": "rico",
      "membro": "",
      "valor_atual": 16613.5,
      "data_referencia": "2026-03-29",
      "taxa": "",
      "vencimento": ""
    },
    {
      "nome": "59 R\nConstellation Institucional Advisory FIC\n40",
      "tipo": "FundoInvestimento",
      "instituicao": "rico",
      "membro": "",
      "valor_atual": 12585.32,
      "data_referencia": "2026-03-29",
      "taxa": "",
      "vencimento": ""
    },
    {
      "nome": "quida Bruta aplicado\n35 Western Asset BDR FIF",
      "tipo": "FundoInvestimento",
      "instituicao": "rico",
      "membro": "",
      "valor_atual": 25913.09,
      "data_referencia": "2026-03-29",
      "taxa": "",
      "vencimento": ""
    },
    {
      "nome": "quida Bruta aplicado\nHashdex 20 Nasdaq Crypto Index FIF\n15",
      "tipo": "FundoInvestimento",
      "instituicao": "rico",
      "membro": "",
      "valor_atual": 3264.13,
      "data_referencia": "2026-03-29",
      "taxa": "",
      "vencimento": ""
    },
    {
      "nome": "o Sofisticada FIM CP RL",
      "tipo": "FundoInvestimento",
      "instituicao": "rico",
      "membro": "",
      "valor_atual": 1576.08,
      "data_referencia": "2026-03-29",
      "taxa": "",
      "vencimento": ""
    },
    {
      "nome": "es",
      "tipo": "FundoInvestimento",
      "instituicao": "rico",
      "membro": "",
      "valor_atual": 96931.16,
      "data_referencia": "2026-03-29",
      "taxa": "",
      "vencimento": ""
    },
    {
      "nome": "28 PETR4",
      "tipo": "FundoInvestimento",
      "instituicao": "rico",
      "membro": "",
      "valor_atual": 83946.0,
      "data_referencia": "2026-03-29",
      "taxa": "",
      "vencimento": ""
    },
    {
      "nome": "1\n37 ITSA4",
      "tipo": "FundoInvestimento",
      "instituicao": "rico",
      "membro": "",
      "valor_atual": 10285.16,
      "data_referencia": "2026-03-29",
      "taxa": "",
      "vencimento": ""
    },
    {
      "nome": "7\n28 BRKM5",
      "tipo": "FundoInvestimento",
      "instituicao": "rico",
      "membro": "",
      "valor_atual": 2700.0,
      "data_referencia": "2026-03-29",
      "taxa": "",
      "vencimento": ""
    }
  ],
  "total_por_membro": {
    "": 1375866.98
  },
  "total_geral": 1375866.98,
  "fontes": [
    "itau_investimentosposicao_202603-2_extract.json",
    "rico_investimentosposicao_202603-2_extract.json"
  ],
  "data_consolidacao": "2026-04-08",
  "n_posicoes": 18
}